{
  "burst": 64,
  "spawnRate": 240,
  "refreshSeconds": 2,
  "maximumVehicles": 12000,
  "attemptsPerUpdate": 192,
  "localMaximum": 2400,
  "minimumTripSteps": 6,
  "maximumTripSteps": 28,
  "tripSearchSteps": 160,
  "focusRadius": 1800,
  "localCarsPerBuilding": 0.65,
  "peoplePerCar": 125,
  "commercialCars": 0.1,
  "industrialCars": 0.16,
  "morningMultiplier": 1.5,
  "dayMultiplier": 1,
  "eveningMultiplier": 1.7,
  "lateMultiplier": 0.6,
  "nightMultiplier": 0.2,
  "industrialFreightWeight": 2,
  "residentFreightWeight": 8,
  "minimumFreightShare": 0.08,
  "maximumFreightShare": 0.45,
  "largeTruckFreightShare": 0.35,
  "smallTruckFreightShare": 0.65,
  "outsideBorderDistance": 80,
  "outsideExpresswayWeight": 4,
  "outsideInboundShare": 0.3,
  "outsideOutboundShare": 0.12,
  "outsideMinimumVehicles": 8,
  "outsideMaximumVehicles": 1500,
  "outsideSpawnRate": 6
}
